<!ELEMENT resource-list (resource*)>
<!ELEMENT resource (#PCDATA)>
<!ATTLIST resource name CDATA #REQUIRED>
<!ATTLIST resource phase (solid|liquid|gas) #REQUIRED>
<!ATTLIST resource life-support (true|false) #REQUIRED>
